{
  "$schema": "../../../schemas/request-v1.schema.json",
  "formatVersion": 1,
  "kind": "request",
  "meta": { "id": "users.create", "name": "Create user", "tags": ["users"] },
  "bindings": {
    "user":      { "ref": "data:users#/valid/alice" },
    "tenant":    { "ref": "data:tenants#/default" },
    "requestId": { "use": "builtin:uuid@1" }
  },
  "request": {
    "method": "POST",
    "url": "${env.baseUrl}/users",
    "headers": [
      { "name": "Content-Type", "value": "application/json", "enabled": true },
      { "name": "X-Request-ID", "value": "${bindings.requestId}", "enabled": true }
    ],
    "body": {
      "type": "json",
      "value": {
        "name": "${bindings.user.name}",
        "email": "${bindings.user.email}",
        "tenantId": "${bindings.tenant.id}"
      }
    }
  },
  "pipeline": [
    { "phase": "beforeRequest", "use": "builtin:bearer@1", "with": { "token": "${secret.apiToken}" } },
    { "phase": "afterResponse", "use": "builtin:assert-status@1", "with": { "expected": 201 } },
    { "phase": "afterResponse", "use": "builtin:assert-json-path@1", "with": { "path": "$.json.name", "operator": "equals", "value": "${bindings.user.name}" } },
    { "phase": "afterResponse", "use": "builtin:extract-json-path@1", "with": { "path": "$.json.email", "target": "userEmail" } }
  ],
  "mock": {
    "status": 201,
    "body": { "ref": "data:user-responses#/created" }
  }
}
